published_at,title,description,source,url,symbol,query,text
2026-03-28 23:12:00,Crypto News of Last 24 Hours: Pepeto Crosses $8.47M While Bitcoin Price Targets $200K and Trump Family $1.2B Profits Reveal Where Insiders Are Moving,"Dubai, UAE, March 28, 2026 (GLOBE NEWSWIRE) -- Pepeto crossed $8.47 million in presale capital with stages selling out faster every round, and the wallets entering this project are not retail chasing momentum. They are addresses that move before the crowd, th…",GlobeNewswire,https://www.globenewswire.com/news-release/2026/03/28/3264211/0/en/Crypto-News-of-Last-24-Hours-Pepeto-Crosses-8-47M-While-Bitcoin-Price-Targets-200K-and-Trump-Family-1-2B-Profits-Reveal-Where-Insiders-Are-Moving.html,BTC-USD,Bitcoin price,"Crypto News of Last 24 Hours: Pepeto Crosses $8.47M While Bitcoin Price Targets $200K and Trump Family $1.2B Profits Reveal Where Insiders Are Moving. Dubai, UAE, March 28, 2026 (GLOBE NEWSWIRE) -- Pepeto crossed $8.47 million in presale capital with stages selling out faster every round, and the wallets entering this project are not retail chasing momentum. They are addresses that move before the crowd, th…"
2026-03-28 23:43:00,Ethereum based Pepeto Exchange Update While XRP price retreats to $1.35 support – But recovery Might happen Soon,"Dubai, UAE, March 28, 2026 (GLOBE NEWSWIRE) -- The Pepeto team confirmed a major update to the exchange infrastructure as the presale pushes past $8.47 million with entries arriving faster every stage. The tools were designed to deliver what Ethereum traders …",GlobeNewswire,https://www.globenewswire.com/news-release/2026/03/28/3264214/0/en/Ethereum-based-Pepeto-Exchange-Update-While-XRP-price-retreats-to-1-35-support-But-recovery-Might-happen-Soon.html,ETH-USD,Ethereum price,"Ethereum based Pepeto Exchange Update While XRP price retreats to $1.35 support – But recovery Might happen Soon. Dubai, UAE, March 28, 2026 (GLOBE NEWSWIRE) -- The Pepeto team confirmed a major update to the exchange infrastructure as the presale pushes past $8.47 million with entries arriving faster every stage. The tools were designed to deliver what Ethereum traders …"
2026-03-28 23:55:00,"Save 35% Off the TP-Link Deco 7 Pro BE10000 Mesh System, Amazon's Best Selling Wi-Fi 7 Router","Incredibly priced, feature-rich, and blazing fast networking bundle, but it might not be around for very long.",IGN,https://www.ign.com/articles/tp-link-whole-home-mesh-system-wifi-7-router-deal-amazon-spring-sale,GC=F,gold price market,"Save 35% Off the TP-Link Deco 7 Pro BE10000 Mesh System, Amazon's Best Selling Wi-Fi 7 Router. Incredibly priced, feature-rich, and blazing fast networking bundle, but it might not be around for very long."
2026-03-28 23:56:00,Crypto News Today: Pepeto Project News While Bull Run Signals Align and Dogecoin SEC Commodity Ruling Opens the Door for What Comes Next,"Dubai, UAE, March 28, 2026 (GLOBE NEWSWIRE) -- Pepeto pushed past $8.47 million after its latest round closed ahead of schedule while the crypto news today delivered the catalysts this bull run has been waiting for.",GlobeNewswire,https://www.globenewswire.com/news-release/2026/03/28/3264215/0/en/Crypto-News-Today-Pepeto-Project-News-While-Bull-Run-Signals-Align-and-Dogecoin-SEC-Commodity-Ruling-Opens-the-Door-for-What-Comes-Next.html,BTC-USD,crypto market rally,"Crypto News Today: Pepeto Project News While Bull Run Signals Align and Dogecoin SEC Commodity Ruling Opens the Door for What Comes Next. Dubai, UAE, March 28, 2026 (GLOBE NEWSWIRE) -- Pepeto pushed past $8.47 million after its latest round closed ahead of schedule while the crypto news today delivered the catalysts this bull run has been waiting for."
2026-03-29 00:00:00,Influence of equity structure in China’s high-tech manufacturing industry on enterprise value under epidemic shocks,"The COVID-19 pandemic represented a profound exogenous shock to global economic systems, posing substantial challenges to corporate governance frameworks and value creation—particularly within technology-intensive industries. This study investigates the relat…",Nature.com,https://www.nature.com/articles/s41598-026-46108-6,BTC-USD,Bitcoin price,"Influence of equity structure in China’s high-tech manufacturing industry on enterprise value under epidemic shocks. The COVID-19 pandemic represented a profound exogenous shock to global economic systems, posing substantial challenges to corporate governance frameworks and value creation—particularly within technology-intensive industries. This study investigates the relat…"
2026-03-29 00:00:13,"Ethereum Struggles Below $2,000 As Volume Dries Up And Bears Dominate","Ethereum continues to struggle below the critical $2,000 level, with price losing momentum as volume fades and selling pressure builds. The lack of strong buyer interest leaves the market vulnerable, allowing bears to maintain control while key support levels…",Bitcoinist,https://bitcoinist.com/ethereum-struggles-below-2000-as-volume-dries-up-and-bears-dominate/,ETH-USD,Ethereum price,"Ethereum Struggles Below $2,000 As Volume Dries Up And Bears Dominate. Ethereum continues to struggle below the critical $2,000 level, with price losing momentum as volume fades and selling pressure builds. The lack of strong buyer interest leaves the market vulnerable, allowing bears to maintain control while key support levels…"
2026-03-29 00:00:53,Bitcoin Short-Term Holders Capitulate As 22K BTC Flow To Exchanges,"The price of Bitcoin succumbed to bearish pressure and fell to around $65,500 on Friday, while the geopolitical tensions between the United States, Israel, and Iran seem to worsen. According to a recent on-chain evaluation, this latest price decline appears t…",newsBTC,http://www.newsbtc.com/news/bitcoin/bitcoin-sth-capitulate-21k-btc-hit-exchanges/,BTC-USD,Bitcoin price,"Bitcoin Short-Term Holders Capitulate As 22K BTC Flow To Exchanges. The price of Bitcoin succumbed to bearish pressure and fell to around $65,500 on Friday, while the geopolitical tensions between the United States, Israel, and Iran seem to worsen. According to a recent on-chain evaluation, this latest price decline appears t…"
2026-03-29 00:07:00,"Pepeto Announces Stage Sold Out While BNB Price Prediction Targets $3,000 as Crypto News Reveals What BNB Holders Need to Know","Dubai, UAE, March 28, 2026 (GLOBE NEWSWIRE) -- Pepeto presale crossed $8.47 million after its latest presale round closed ahead of schedule, and the crypto news connecting this project to the BNB price prediction tells a story every BNB holder needs to unders…",GlobeNewswire,https://www.globenewswire.com/news-release/2026/03/29/3264216/0/en/Pepeto-Announces-Stage-Sold-Out-While-BNB-Price-Prediction-Targets-3-000-as-Crypto-News-Reveals-What-BNB-Holders-Need-to-Know.html,ETH-USD,Ethereum price,"Pepeto Announces Stage Sold Out While BNB Price Prediction Targets $3,000 as Crypto News Reveals What BNB Holders Need to Know. Dubai, UAE, March 28, 2026 (GLOBE NEWSWIRE) -- Pepeto presale crossed $8.47 million after its latest presale round closed ahead of schedule, and the crypto news connecting this project to the BNB price prediction tells a story every BNB holder needs to unders…"
2026-03-29 01:00:22,"Bitcoin Last Line Of Defense Revealed: Can BTC Price Still Go To $40,000?","Bitcoin is currently trading around $66,400, which is almost 48% below its all-time high of $126,080 set in October 2025, and a technical analysis is drawing a line in the sand for the correction.  According to a crypto analyst known as Leshka.eth, Bitcoin is…",newsBTC,http://www.newsbtc.com/news/bitcoin/bitcoin-last-line-of-defense-revealed-can-btc-price-still-go-to-40000/,BTC-USD,Bitcoin price,"Bitcoin Last Line Of Defense Revealed: Can BTC Price Still Go To $40,000?. Bitcoin is currently trading around $66,400, which is almost 48% below its all-time high of $126,080 set in October 2025, and a technical analysis is drawing a line in the sand for the correction.  According to a crypto analyst known as Leshka.eth, Bitcoin is…"
2026-03-29 01:18:03,"DAVID BLACKMON: Competition, Not Monopoly Control, The Answer To Grid Reliability","America’s electricity debate is drifting toward a dangerous simplification: that if prices rise or investment lags, the culprit must be “the market,” and the",The Daily Caller,https://dailycaller.com/2026/03/28/opinion-competition-not-monopoly-control-the-answer-to-grid-reliability-david-blackmon/,GC=F,gold price market,"DAVID BLACKMON: Competition, Not Monopoly Control, The Answer To Grid Reliability. America’s electricity debate is drifting toward a dangerous simplification: that if prices rise or investment lags, the culprit must be “the market,” and the"
2026-03-29 01:45:10,NRB issues today’s foreign currency exchange rates,"KATHMANDU: Nepal Rastra Bank (NRB) has set the foreign exchange rates for Sunday. The buying rate for one US dollar (USD) is Rs 151.41, while the selling rate is Rs 152.01. The Euro is priced at Rs 174.32 (buy) and Rs 175.01 (sell), and the pound streling at …",Khabarhub.com,https://english.khabarhub.com/2026/29/541542/,EURUSD=X,euro dollar exchange rate,"NRB issues today’s foreign currency exchange rates. KATHMANDU: Nepal Rastra Bank (NRB) has set the foreign exchange rates for Sunday. The buying rate for one US dollar (USD) is Rs 151.41, while the selling rate is Rs 152.01. The Euro is priced at Rs 174.32 (buy) and Rs 175.01 (sell), and the pound streling at …"
2026-03-29 02:00:34,Bitcoin Breakdown Confirmed: Bearish Continuation Looms Despite Short-Term Bounce Setup,"Bitcoin’s recent price action confirms a clear structural breakdown, ending weeks of compression and shifting momentum to the downside. While a short-term bounce remains possible as price fills nearby imbalances, the broader outlook stays bearish. Unless key …",newsBTC,http://www.newsbtc.com/news/bitcoin/bitcoin-breakdown-confirmed/,BTC-USD,Bitcoin price,"Bitcoin Breakdown Confirmed: Bearish Continuation Looms Despite Short-Term Bounce Setup. Bitcoin’s recent price action confirms a clear structural breakdown, ending weeks of compression and shifting momentum to the downside. While a short-term bounce remains possible as price fills nearby imbalances, the broader outlook stays bearish. Unless key …"
2026-03-29 02:54:22,"Silver Rate Today, March 29, 2026: Check Latest Prices of White Metal in Delhi, Mumbai, Chennai and Other Major Cities","Today, March 29, silver prices (silver rates) in India stabilised at INR 2.45 lakh per kg in Delhi and Mumbai, while southern markets like Chennai held at INR 2.50 lakh. After a volatile month with a 17 per cent correction from early peaks, the metal is findi…",LatestLY,https://www.latestly.com/business/silver-rate-today-march-29-2026-check-latest-prices-of-white-metal-in-delhi-mumbai-chennai-and-other-major-cities-7371417.html,GC=F,gold price market,"Silver Rate Today, March 29, 2026: Check Latest Prices of White Metal in Delhi, Mumbai, Chennai and Other Major Cities. Today, March 29, silver prices (silver rates) in India stabilised at INR 2.45 lakh per kg in Delhi and Mumbai, while southern markets like Chennai held at INR 2.50 lakh. After a volatile month with a 17 per cent correction from early peaks, the metal is findi…"
2026-03-29 03:12:58,polymarket-trading-mcp added to PyPI,"MCP server and Python toolkit for Polymarket prediction markets: slippage estimation, liquidity scanning, arbitrage detection, price feeds, and sentiment analysis.",Pypi.org,https://pypi.org/project/polymarket-trading-mcp/,BTC-USD,Bitcoin price,"polymarket-trading-mcp added to PyPI. MCP server and Python toolkit for Polymarket prediction markets: slippage estimation, liquidity scanning, arbitrage detection, price feeds, and sentiment analysis."
2026-03-29 05:00:36,XRP Futures Market Keeps Resetting As Whales Accumulate Amid Mixed Signals,"Long traders in XRP futures market have been repeatedly wiped out in recent weeks, even as large holders quietly add to their positions. Liquidations on Binance topped $2.5 million on March 18, followed by another $2.45 million four days later, and $2.15 mill…",newsBTC,http://www.newsbtc.com/altcoin/xrp-futures-market-keeps-resetting-as-whales-accumulate-amid-mixed-signals/,BTC-USD,Bitcoin price,"XRP Futures Market Keeps Resetting As Whales Accumulate Amid Mixed Signals. Long traders in XRP futures market have been repeatedly wiped out in recent weeks, even as large holders quietly add to their positions. Liquidations on Binance topped $2.5 million on March 18, followed by another $2.45 million four days later, and $2.15 mill…"
2026-03-29 05:00:58,Senator Defends CLARITY Act As Developer Protection Debate Heats Up,A crypto developer was convicted last year for running an unlicensed money-transmitting business. That case — and others like it — is now driving one of the sharpest disagreements in Washington over how the US plans to regulate decentralized finance. Related …,Bitcoinist,https://bitcoinist.com/senator-defends-clarity-act-as-developer-protection-debate-heats-up/,ETH-USD,DeFi market,Senator Defends CLARITY Act As Developer Protection Debate Heats Up. A crypto developer was convicted last year for running an unlicensed money-transmitting business. That case — and others like it — is now driving one of the sharpest disagreements in Washington over how the US plans to regulate decentralized finance. Related …
2026-03-29 05:15:28,"Gold price surges by Rs 5,000, silver also rises in Nepali market","KATHMANDU: The price of gold, which had fallen by Rs 7,500 over the past two days, has surged again today, while silver has also become more expensive. According to the Nepal Gold and Silver Dealers Federation, the price of gold increased by Rs 5,000 per tola…",Khabarhub.com,https://english.khabarhub.com/2026/29/541583/,GC=F,gold price market,"Gold price surges by Rs 5,000, silver also rises in Nepali market. KATHMANDU: The price of gold, which had fallen by Rs 7,500 over the past two days, has surged again today, while silver has also become more expensive. According to the Nepal Gold and Silver Dealers Federation, the price of gold increased by Rs 5,000 per tola…"
2026-03-29 05:55:16,Crude oil shock deepens market jitters as Hormuz crisis hits India’s macro outlook,Bernstein warned that escalating West Asia tensions and a sustained crude price spike are increasing risks to India’s macro outlook,BusinessLine,https://www.thehindubusinessline.com/markets/crude-oil-shock-deepens-market-jitters-as-hormuz-crisis-hits-indias-macro-outlook/article70798845.ece,GC=F,gold price market,Crude oil shock deepens market jitters as Hormuz crisis hits India’s macro outlook. Bernstein warned that escalating West Asia tensions and a sustained crude price spike are increasing risks to India’s macro outlook
2026-03-29 05:58:18,readwhitepaper added to PyPI,"Python client for ReadWhitepaper — blockchain whitepaper database with 30 whitepapers, 163 glossary terms, and 15-language translations",Pypi.org,https://pypi.org/project/readwhitepaper/,ETH-USD,DeFi market,"readwhitepaper added to PyPI. Python client for ReadWhitepaper — blockchain whitepaper database with 30 whitepapers, 163 glossary terms, and 15-language translations"
2026-03-29 07:00:04,XRP Price Could Be On The Verge Of A Further 30% Downturn — Here’s Why,"The XRP price has exhibited a seller-dominated market over the past few days, underscoring the continued dominance of the bears in recent weeks. A broader look at the altcoin’s performance shows what looks like a consolidatory range since early February. As t…",newsBTC,http://www.newsbtc.com/xrp-news/xrp-price-could-be-on-the-verge-of-a-downturn/,BTC-USD,Bitcoin price,"XRP Price Could Be On The Verge Of A Further 30% Downturn — Here’s Why. The XRP price has exhibited a seller-dominated market over the past few days, underscoring the continued dominance of the bears in recent weeks. A broader look at the altcoin’s performance shows what looks like a consolidatory range since early February. As t…"
2026-03-29 07:25:00,Dip-buying drives S’pore stocks higher as retail investors pile in amid Iran conflict,"The three local banks, SIngapore Airlines and Singapore Exchange all advanced. Read more at straitstimes.com. Read more at straitstimes.com.",The Straits Times,https://www.straitstimes.com/business/dip-buying-drives-spore-stocks-higher-as-retail-investors-pile-in-amid-iran-conflict,GC=F,gold price market,"Dip-buying drives S’pore stocks higher as retail investors pile in amid Iran conflict. The three local banks, SIngapore Airlines and Singapore Exchange all advanced. Read more at straitstimes.com. Read more at straitstimes.com."
2026-03-29 08:00:17,Growing Pressure On BTC: On-Chain Data Reveals Bitcoin’s Institutional Exodus,"Bitcoin is sending distress signals from within. Information tracked from on-chain analytics platform CryptoQuant shows mounting institutional discomfort, and two metrics are simultaneously displaying warning signs that could define Bitcoin’s trajectory for t…",Bitcoinist,https://bitcoinist.com/growing-pressure-on-btc-on-chain-data-reveals-bitcoins-institutional-exodus/,BTC-USD,Bitcoin price,"Growing Pressure On BTC: On-Chain Data Reveals Bitcoin’s Institutional Exodus. Bitcoin is sending distress signals from within. Information tracked from on-chain analytics platform CryptoQuant shows mounting institutional discomfort, and two metrics are simultaneously displaying warning signs that could define Bitcoin’s trajectory for t…"
2026-03-29 08:05:18,"BNP Paribas adds six Bitcoin, Ether ETNs for retail clients in France",BNP Paribas rolls out six Bitcoin and Ether-linked ETNs for retail clients in France as banks deepen push into regulated crypto exposure.,Cointelegraph,https://cointelegraph.com/news/bnp-paribas-bitcoin-ether-etns-france-retail,BTC-USD,Bitcoin price,"BNP Paribas adds six Bitcoin, Ether ETNs for retail clients in France. BNP Paribas rolls out six Bitcoin and Ether-linked ETNs for retail clients in France as banks deepen push into regulated crypto exposure."
2026-03-29 09:00:06,"The Crowd Is Bearish On Bitcoin, But History Says That’s Bullish","Santiment data shows that bearish sentiment language is flooding social media at peak levels. However, this might actually be a good thing for smart bullish investors, as the sentiment data proposes that what retail traders are saying may be setting up the op…",newsBTC,http://www.newsbtc.com/news/bitcoin/the-crowd-is-bearish-on-bitcoin-but-history-says-thats-bullish/,BTC-USD,Bitcoin price,"The Crowd Is Bearish On Bitcoin, But History Says That’s Bullish. Santiment data shows that bearish sentiment language is flooding social media at peak levels. However, this might actually be a good thing for smart bullish investors, as the sentiment data proposes that what retail traders are saying may be setting up the op…"
2026-03-29 09:54:16,polymarket-kit added to PyPI,"Fully typed Polymarket SDK for Python — Gamma, CLOB, Data API, WebSocket, and order placement",Pypi.org,https://pypi.org/project/polymarket-kit/,BTC-USD,Bitcoin price,"polymarket-kit added to PyPI. Fully typed Polymarket SDK for Python — Gamma, CLOB, Data API, WebSocket, and order placement"
2026-03-29 10:26:38,The next Bitcoin shock could be where Wall Street finally loses faith and starts selling,"Bitcoin's price dropped below $67,000 this weekend, after a brutal slide that left it more than 40% below its October 2025 peak. In February, BTC had fallen about 47% from its high near $126,000. In an earlier version of this market, that kind of drop would c…",CryptoSlate,https://cryptoslate.com/the-next-bitcoin-shock-could-be-where-wall-street-finally-loses-faith-and-starts-selling/,BTC-USD,Bitcoin price,"The next Bitcoin shock could be where Wall Street finally loses faith and starts selling. Bitcoin's price dropped below $67,000 this weekend, after a brutal slide that left it more than 40% below its October 2025 peak. In February, BTC had fallen about 47% from its high near $126,000. In an earlier version of this market, that kind of drop would c…"
2026-03-29 10:51:21,"Onchain commodity trading is here to stay, but liquidity remains an issue","Onchain commodity trading is proving more than a short-term spike, with rising oil and gold volumes, but limited liquidity still keeps traditional markets dominant.",Cointelegraph,https://cointelegraph.com/news/onchain-commodity-trading-liquidity-gap-tradfi-depth,GC=F,gold price market,"Onchain commodity trading is here to stay, but liquidity remains an issue. Onchain commodity trading is proving more than a short-term spike, with rising oil and gold volumes, but limited liquidity still keeps traditional markets dominant."
2026-03-29 10:57:29,CLARITY Act in Current Form Threatens Crypto Development and DeFi Innovation,"As the CLARITY and BRCA acts continue to stall in the US Congress, the future of the crypto economy is grim if they pass in their current form, according to Peter Van Valkenburgh, the CEO of Coin Center. In a lengthy X post, the head of the popular crypto non…",ZyCrypto,https://zycrypto.com/clarity-act-in-current-form-threatens-crypto-development-and-defi-innovation/,ETH-USD,DeFi market,"CLARITY Act in Current Form Threatens Crypto Development and DeFi Innovation. As the CLARITY and BRCA acts continue to stall in the US Congress, the future of the crypto economy is grim if they pass in their current form, according to Peter Van Valkenburgh, the CEO of Coin Center. In a lengthy X post, the head of the popular crypto non…"
2026-03-29 11:00:34,Traders Pile Into Bets Against Bitcoin Price — Is A Short Squeeze Looming?,"After declining to around $65,500 on Friday, Bitcoin appears to be recovering slowly this weekend. Having briefly reclaimed the $67,000 level on Saturday, March 28, the premier cryptocurrency seems to be enjoying a brewing bullish momentum. According to the l…",newsBTC,http://www.newsbtc.com/news/bitcoin/traders-into-bets-against-bitcoin-price/,BTC-USD,Bitcoin price,"Traders Pile Into Bets Against Bitcoin Price — Is A Short Squeeze Looming?. After declining to around $65,500 on Friday, Bitcoin appears to be recovering slowly this weekend. Having briefly reclaimed the $67,000 level on Saturday, March 28, the premier cryptocurrency seems to be enjoying a brewing bullish momentum. According to the l…"
2026-03-29 11:00:48,4 Laptops You Can Actually Buy for Under $200 Right Now,"The sub-$200 laptop market has quietly gotten more interesting than it has any right to be. A few years ago, spending less than two hundred dollars on a laptop meant settling for something that could barely keep a browser tab alive without wheezing. That calc…",The Gadgeteer,https://the-gadgeteer.com/2026/03/29/4-laptops-you-can-actually-buy-for-under-200-right-now/,GC=F,gold price market,"4 Laptops You Can Actually Buy for Under $200 Right Now. The sub-$200 laptop market has quietly gotten more interesting than it has any right to be. A few years ago, spending less than two hundred dollars on a laptop meant settling for something that could barely keep a browser tab alive without wheezing. That calc…"
2026-03-29 11:22:27,Investment Banking Giant Morgan Stanley Shakes Up Bitcoin ETF Space With Industry-Lowest Fees,"Morgan Stanley is seeking to debut its spot Bitcoin exchange-traded fund with a 0.14% fee, according to an amended filing with the U.S. SEC.",ZyCrypto,https://zycrypto.com/investment-banking-giant-morgan-stanley-shakes-up-bitcoin-etf-space-with-industry-lowest-fees/,BTC-USD,Bitcoin price,"Investment Banking Giant Morgan Stanley Shakes Up Bitcoin ETF Space With Industry-Lowest Fees. Morgan Stanley is seeking to debut its spot Bitcoin exchange-traded fund with a 0.14% fee, according to an amended filing with the U.S. SEC."
2026-03-29 11:34:00,Affirm: A Solid Footing or More Volatility Ahead?,"Affirm stock is gaining attention as the buy-now-pay-later lender shows growth and improving profitability, but risks remain in credit quality and...",MarketBeat,https://www.marketbeat.com/originals/affirm-a-solid-footing-or-more-volatility-ahead/?utm_source=yahoofinance&amp;utm_medium=yahoofinance,GC=F,gold price market,"Affirm: A Solid Footing or More Volatility Ahead?. Affirm stock is gaining attention as the buy-now-pay-later lender shows growth and improving profitability, but risks remain in credit quality and..."
2026-03-29 12:00:14,How Weakening US Labor Data Could Impact Bitcoin Market — Report,"The global macro environment has been one of the major defining factors in Bitcoin and the broader crypto market so far this year. From the brewing geopolitical tensions in the Middle East to the rising inflation expectations in the United States, the global …",Bitcoinist,https://bitcoinist.com/how-weakening-us-labor-data-could-impact-bitcoin/,BTC-USD,Bitcoin price,"How Weakening US Labor Data Could Impact Bitcoin Market — Report. The global macro environment has been one of the major defining factors in Bitcoin and the broader crypto market so far this year. From the brewing geopolitical tensions in the Middle East to the rising inflation expectations in the United States, the global …"
