published_at,title,description,source,url,symbol,query,text
2026-03-06 16:33:54,"Delta: Chicago – Nairobi, Kenya. $903. Roundtrip, including all Taxes","A good sale to Nairobi. Pricing will vary slightly depending on routingSample Travel Date:November 17th - 24thThis is just ONE SAMPLE travel date, for more availability, pl",Theflightdeal.com,https://www.theflightdeal.com/2026/03/06/delta-chicago-nairobi-kenya-903-roundtrip-including-all-taxes/,KES=X,Kenya shilling dollar,"Delta: Chicago – Nairobi, Kenya. $903. Roundtrip, including all Taxes. A good sale to Nairobi. Pricing will vary slightly depending on routingSample Travel Date:November 17th - 24thThis is just ONE SAMPLE travel date, for more availability, pl"
2026-03-11 00:00:00,A big-push community intervention reduced rates of child marriage by 80%,"A community-wide intervention in northern Nigeria reduced rates of&nbsp;child marriage from 79% to 14%, showing that bundled, big-push approaches can dramatically shift entrenched behaviours.",Nature.com,https://www.nature.com/articles/s41586-026-10206-2,KES=X,Kenya central bank rate,"A big-push community intervention reduced rates of child marriage by 80%. A community-wide intervention in northern Nigeria reduced rates of&nbsp;child marriage from 79% to 14%, showing that bundled, big-push approaches can dramatically shift entrenched behaviours."
2026-03-11 00:45:13,Foreign currency exchange rates fixed for today,"KATHMANDU: Nepal Rastra Bank has fixed the foreign currency exchange rates for today. According to the central bank, the buying rate of one US dollar has been set at Rs 146.60, while the selling rate is Rs 147.20. Similarly, the buying rate of one euro is Rs …",Khabarhub.com,https://english.khabarhub.com/2026/11/538732/,EURUSD=X,euro dollar exchange rate,"Foreign currency exchange rates fixed for today. KATHMANDU: Nepal Rastra Bank has fixed the foreign currency exchange rates for today. According to the central bank, the buying rate of one US dollar has been set at Rs 146.60, while the selling rate is Rs 147.20. Similarly, the buying rate of one euro is Rs …"
2026-03-11 14:00:00,Economic evaluation of anti-malarial drug policies across presidential regimes in Nigeria: A comparative analysis from 1999 to present,"Background Malaria remains a significant public health challenge in Nigeria, accounting for substantial morbidity, mortality, and economic loss. Successive administrations have implemented various anti-malarial drug policies aimed at curbing this endemic dise…",Plos.org,https://journals.plos.org/plosone/article?id=10.1371/journal.pone.0344909,KES=X,Kenya central bank rate,"Economic evaluation of anti-malarial drug policies across presidential regimes in Nigeria: A comparative analysis from 1999 to present. Background Malaria remains a significant public health challenge in Nigeria, accounting for substantial morbidity, mortality, and economic loss. Successive administrations have implemented various anti-malarial drug policies aimed at curbing this endemic dise…"
2026-03-12 06:00:00,"Pharming Group reports fourth quarter and full year 2025 financial results, delivering strong revenue growth and profitability with positive cash flow","Pharming Group reports fourth quarter and full year 2025 financial results, delivering strong revenue growth and profitability with positive cash flow...",GlobeNewswire,https://www.globenewswire.com/news-release/2026/03/12/3254281/0/en/Pharming-Group-reports-fourth-quarter-and-full-year-2025-financial-results-delivering-strong-revenue-growth-and-profitability-with-positive-cash-flow.html,EURUSD=X,euro dollar exchange rate,"Pharming Group reports fourth quarter and full year 2025 financial results, delivering strong revenue growth and profitability with positive cash flow. Pharming Group reports fourth quarter and full year 2025 financial results, delivering strong revenue growth and profitability with positive cash flow..."
2026-03-12 06:30:00,RUBIS:  Full-Year 2025 results - Another record year - Net income Group share up +19%,"Paris, 12 March 2026, 7:30am      Solid operating performance more than outweighed the unfavourable EUR/USD exchange-rate movements, driven by the steady...",GlobeNewswire,https://www.globenewswire.com/news-release/2026/03/12/3254288/0/en/RUBIS-Full-Year-2025-results-Another-record-year-Net-income-Group-share-up-19.html,KES=X,Kenya central bank rate,"RUBIS:  Full-Year 2025 results - Another record year - Net income Group share up +19%. Paris, 12 March 2026, 7:30am      Solid operating performance more than outweighed the unfavourable EUR/USD exchange-rate movements, driven by the steady..."
2026-03-13 07:04:00,"K.M and the (as if he would do it) elections, fears & hopes for tourism, Nikos A.’s “Odyssey,” EKKOMED’s money & complaints, the extremely wealthy Spaniard","China, Tsakos, West Africa, and Venezuela
The post K.M and the (as if he would do it) elections, fears & hopes for tourism, Nikos A.’s “Odyssey,” EKKOMED’s money & complaints, the extremely wealthy Spaniard appeared first on ProtoThema English.",Protothema.gr,https://en.protothema.gr/2026/03/13/k-m-and-the-as-if-he-would-do-it-elections-fears-hopes-for-tourism-nikos-a-s-odyssey-ekkomeds-money-complaints-the-extremely-wealthy-spaniard/,EURUSD=X,euro dollar exchange rate,"K.M and the (as if he would do it) elections, fears & hopes for tourism, Nikos A.’s “Odyssey,” EKKOMED’s money & complaints, the extremely wealthy Spaniard. China, Tsakos, West Africa, and Venezuela
The post K.M and the (as if he would do it) elections, fears & hopes for tourism, Nikos A.’s “Odyssey,” EKKOMED’s money & complaints, the extremely wealthy Spaniard appeared first on ProtoThema English."
2026-03-13 12:07:43,"Euro, Yen Sink to New Lows Against Dollar as Oil Pain Deepens","The euro and yen were falling on Friday as oil traded around $100 a barrel, compounding pressure on economies reliant on energy imports as the Iran conflict shows no signs of ending.",Financial Post,https://financialpost.com/pmn/business-pmn/euro-yen-sink-to-new-lows-against-dollar-as-oil-pain-deepens,EURUSD=X,euro dollar exchange rate,"Euro, Yen Sink to New Lows Against Dollar as Oil Pain Deepens. The euro and yen were falling on Friday as oil traded around $100 a barrel, compounding pressure on economies reliant on energy imports as the Iran conflict shows no signs of ending."
2026-03-13 14:28:59,"Luxury carmakers Mercedes, Audi plan fresh price hikes from April amid rupee slide",Mercedes and Audi announce 2% price hikes from April 1 due to rupee depreciation and rising input costs in India.,BusinessLine,https://www.thehindubusinessline.com/news/luxury-carmakers-mercedes-audi-plan-fresh-price-hikes-from-april-amid-rupee-slide/article70740042.ece,EURUSD=X,euro dollar exchange rate,"Luxury carmakers Mercedes, Audi plan fresh price hikes from April amid rupee slide. Mercedes and Audi announce 2% price hikes from April 1 due to rupee depreciation and rising input costs in India."
2026-03-14 00:00:00,"The Real Agenda Behind Venezuela, Iran & Greenland","This is not about Liberating Oppressed Peoples, it is about Establishing Global Maritime Supremacy & a Chokehold on World Trade I had written an article several months back discussing the real agenda behind Trump’s enthusiastic backing of the sale CK Hutchiso…",Activistpost.com,https://www.activistpost.com/the-real-agenda-behind-venezuela-iran-greenland/,KES=X,Kenya central bank rate,"The Real Agenda Behind Venezuela, Iran & Greenland. This is not about Liberating Oppressed Peoples, it is about Establishing Global Maritime Supremacy & a Chokehold on World Trade I had written an article several months back discussing the real agenda behind Trump’s enthusiastic backing of the sale CK Hutchiso…"
2026-03-14 05:30:31,Dollar rises broadly as investors weigh Middle East risks,"The US dollar strengthened globally on Friday, driven by Middle East conflict and investor flight to safety.  Rising oil prices, fueled by geopolitical tensions, are impacting energy-importing economies like the Eurozone and Japan, while the US remains relati…",The Times of India,https://economictimes.indiatimes.com/markets/forex/forex-news/dollar-rises-broadly-as-investors-weigh-middle-east-risks/articleshow/129569310.cms,EURUSD=X,euro dollar exchange rate,"Dollar rises broadly as investors weigh Middle East risks. The US dollar strengthened globally on Friday, driven by Middle East conflict and investor flight to safety.  Rising oil prices, fueled by geopolitical tensions, are impacting energy-importing economies like the Eurozone and Japan, while the US remains relati…"
2026-03-14 13:00:01,"27-year-old Amazon employee relocated from India to Ireland and spends up to $2,927 a month: 'My quality of life has improved'",Suras Nayak moved to Ireland in 2025 and works as a software development engineer at Amazon.,CNBC,https://www.cnbc.com/2026/03/14/amazon-software-engineer-relocated-from-india-ireland.html,EURUSD=X,euro dollar exchange rate,"27-year-old Amazon employee relocated from India to Ireland and spends up to $2,927 a month: 'My quality of life has improved'. Suras Nayak moved to Ireland in 2025 and works as a software development engineer at Amazon."
2026-03-14 18:53:28,"Delta / Air France / KLM Royal Dutch: San Francisco – Nairobi, Kenya. $908. Roundtrip, including all Taxes","A good sale to Nairobi. Pricing will vary slightly depending on routingSample Travel Date:November 4th - 11thThis is just ONE SAMPLE travel date, for more availability, ple",Theflightdeal.com,https://www.theflightdeal.com/2026/03/14/delta-air-france-klm-royal-dutch-san-francisco-nairobi-kenya-908-roundtrip-including-all-taxes-2/,KES=X,Kenya shilling dollar,"Delta / Air France / KLM Royal Dutch: San Francisco – Nairobi, Kenya. $908. Roundtrip, including all Taxes. A good sale to Nairobi. Pricing will vary slightly depending on routingSample Travel Date:November 4th - 11thThis is just ONE SAMPLE travel date, for more availability, ple"
2026-03-15 06:37:11,opencode-monitor added to PyPI,Analytics and monitoring tool for OpenCode AI coding sessions,Pypi.org,https://pypi.org/project/opencode-monitor/,EURUSD=X,euro dollar exchange rate,opencode-monitor added to PyPI. Analytics and monitoring tool for OpenCode AI coding sessions
2026-03-16 00:47:47,NRB sets foreign exchange rates for today,"KATHMANDU: The Nepal Rastra Bank (NRB) has published the official foreign exchange rates for today. According to the central bank, the buying rate of one US Dollar has been fixed at Rs 147.64, while the selling rate stands at Rs 148.24. Similarly, the buying …",Khabarhub.com,https://english.khabarhub.com/2026/16/539490/,EURUSD=X,euro dollar exchange rate,"NRB sets foreign exchange rates for today. KATHMANDU: The Nepal Rastra Bank (NRB) has published the official foreign exchange rates for today. According to the central bank, the buying rate of one US Dollar has been fixed at Rs 147.64, while the selling rate stands at Rs 148.24. Similarly, the buying …"
2026-03-16 01:51:17,Dollar steady as markets brace for busy c.bank week amid Mideast war,"The dollar remains strong near a ten-month peak. Investors await key central bank meetings, including the US Federal Reserve and European Central Bank. Policymakers will assess the impact of higher oil prices on inflation and growth. The Australian dollar gai…",The Times of India,https://economictimes.indiatimes.com/markets/forex/dollar-steady-as-markets-brace-for-busy-c-bank-week-amid-mideast-war/articleshow/129598728.cms,EURUSD=X,euro dollar exchange rate,"Dollar steady as markets brace for busy c.bank week amid Mideast war. The dollar remains strong near a ten-month peak. Investors await key central bank meetings, including the US Federal Reserve and European Central Bank. Policymakers will assess the impact of higher oil prices on inflation and growth. The Australian dollar gai…"
2026-03-16 05:00:00,Tecan presents 2025 results and provides details on program to reignite profitable growth,Ad hoc announcement pursuant to Article 53 of the SIX Exchange Regulation Listing Rules  Tecan presents 2025 results and provides details on program to...,GlobeNewswire,https://www.globenewswire.com/news-release/2026/03/16/3255973/0/en/Tecan-presents-2025-results-and-provides-details-on-program-to-reignite-profitable-growth.html,EURUSD=X,euro dollar exchange rate,Tecan presents 2025 results and provides details on program to reignite profitable growth. Ad hoc announcement pursuant to Article 53 of the SIX Exchange Regulation Listing Rules  Tecan presents 2025 results and provides details on program to...
2026-03-17 05:00:00,How to invest in ... shares,Charges vary wildly between brokers so it pays to take time to compare to see what works for the type of trading you envisage,The Irish Times,https://www.irishtimes.com/your-money/2026/03/17/how-to-invest-in-shares/,EURUSD=X,euro dollar exchange rate,How to invest in ... shares. Charges vary wildly between brokers so it pays to take time to compare to see what works for the type of trading you envisage
2026-03-17 08:38:24,"Naira strengthens to N1,355 per dollar","The Nigerian naira continues its upward trend, strengthening to N1,355/$ at the official foreign exchange market, supported by stable conditions and CBN re

Read More: https://punchng.com/naira-strengthens-to-n1355-per-dollar/",The Punch,https://punchng.com/?p=2092031,EURUSD=X,euro dollar exchange rate,"Naira strengthens to N1,355 per dollar. The Nigerian naira continues its upward trend, strengthening to N1,355/$ at the official foreign exchange market, supported by stable conditions and CBN re

Read More: https://punchng.com/naira-strengthens-to-n1355-per-dollar/"
2026-03-17 10:32:26,"Share Market Highlights: Sensex jumps 568 points, Nifty nears 23,600 in strong close","Sensex, Nifty updates on 17 March 2026:  The Sensex climbed 567.99 points, or 0.75%, to close at 76,070.84, while the Nifty 50 advanced 172.35 points, or 0.74%, to settle at 23,581.15. Indian equities extended their rally for a second straight session, driven…",BusinessLine,https://www.thehindubusinessline.com/markets/stock-market-highlights-march-17-2026/article70749721.ece,EURUSD=X,euro dollar exchange rate,"Share Market Highlights: Sensex jumps 568 points, Nifty nears 23,600 in strong close. Sensex, Nifty updates on 17 March 2026:  The Sensex climbed 567.99 points, or 0.75%, to close at 76,070.84, while the Nifty 50 advanced 172.35 points, or 0.74%, to settle at 23,581.15. Indian equities extended their rally for a second straight session, driven…"
2026-03-17 13:25:45,"Petroyuan is a geopolitical signal, not a monetary system",The yuan is constrained by lack of capital account convertibility and PBOC control on exchange rate. So the dollar’s domination is set to continue,BusinessLine,https://www.thehindubusinessline.com/opinion/petroyuan-is-a-geopolitical-signal-not-a-monetary-system/article70753992.ece,EURUSD=X,euro dollar exchange rate,"Petroyuan is a geopolitical signal, not a monetary system. The yuan is constrained by lack of capital account convertibility and PBOC control on exchange rate. So the dollar’s domination is set to continue"
2026-03-17 20:40:15,Canadian dollar’s resilience at risk as central bankers meet,The Canadian dollar is at risk of losing its edge as the nation’s central bankers gather this week to assess its weakened economy. Read on,Financial Post,https://financialpost.com/news/economy/canadian-dollars-resilience-at-risk,EURUSD=X,euro dollar exchange rate,Canadian dollar’s resilience at risk as central bankers meet. The Canadian dollar is at risk of losing its edge as the nation’s central bankers gather this week to assess its weakened economy. Read on
2026-03-18 05:00:00,Fog of war clouds global rate cut outlook,"The specter of a prolonged energy crunch could dash the hopes of consumers, businesses and investors worldwide for rate cuts this year.",POLITICO.eu,https://www.politico.eu/article/fog-of-war-clouds-global-rate-cut-outlook/,EURUSD=X,ECB monetary policy,"Fog of war clouds global rate cut outlook. The specter of a prolonged energy crunch could dash the hopes of consumers, businesses and investors worldwide for rate cuts this year."
2026-03-18 06:00:00,ECB and peers to adopt wait-and-see approach to Iran war inflation impact,Bank of International Settlements urges interest rate-setters globally not to rush to respond to a spike in energy prices,The Irish Times,https://www.irishtimes.com/business/2026/03/18/ecb-and-peers-to-adopt-wait-and-see-approach-to-iran-war-inflation-impact/,EURUSD=X,ECB monetary policy,ECB and peers to adopt wait-and-see approach to Iran war inflation impact. Bank of International Settlements urges interest rate-setters globally not to rush to respond to a spike in energy prices
2026-03-18 10:29:36,"Share Market Highlights: Sensex jumps 633 pts, Nifty tops 23,700; rupee sinks to record close","Sensex, Nifty updates on 18 March 2026: Indian equity markets extended gains for a third straight session on Wednesday, with the Nifty 50 and Sensex rising about 0.83% each, supported by a rebound in IT stocks and positive cues from Asian peers as oil prices …",BusinessLine,https://www.thehindubusinessline.com/markets/stock-market-highlights-18-march-2026/article70753560.ece,EURUSD=X,ECB monetary policy,"Share Market Highlights: Sensex jumps 633 pts, Nifty tops 23,700; rupee sinks to record close. Sensex, Nifty updates on 18 March 2026: Indian equity markets extended gains for a third straight session on Wednesday, with the Nifty 50 and Sensex rising about 0.83% each, supported by a rebound in IT stocks and positive cues from Asian peers as oil prices …"
2026-03-18 15:38:14,Traders Bet on Two ECB Hikes This Year as Energy Prices Jump,"Traders are fully pricing two interest-rate hikes from the European Central Bank this year, as an attack on Iranian gas assets revives fears of an inflation spike.",Financial Post,https://financialpost.com/pmn/business-pmn/traders-bet-on-two-ecb-hikes-this-year-as-energy-prices-jump,EURUSD=X,ECB monetary policy,"Traders Bet on Two ECB Hikes This Year as Energy Prices Jump. Traders are fully pricing two interest-rate hikes from the European Central Bank this year, as an attack on Iranian gas assets revives fears of an inflation spike."
2026-03-18 15:55:45,The Long Shadow: What the Middle East’s Destination Brands Will Look Like in 2028,"Wars end. Memory lingers. The question that will define the region's next tourism decade is in what shape demand returns, from where, at what yield, and with what brand equity still intact. This paper provides the decision frameworks for managing through unce…",Skift,https://skift.com/2026/03/18/the-long-shadow-what-the-middle-easts-destination-brands-will-look-like-in-2028/,EURUSD=X,euro dollar exchange rate,"The Long Shadow: What the Middle East’s Destination Brands Will Look Like in 2028. Wars end. Memory lingers. The question that will define the region's next tourism decade is in what shape demand returns, from where, at what yield, and with what brand equity still intact. This paper provides the decision frameworks for managing through unce…"
2026-03-18 16:45:00,Touax: Results 2025,"PRESS RELEASE        Paris, 18 March 2026 – 5:45pm  YOUR OPERATIONAL LEASING SOLUTION FOR SUSTAINABLE TRANSPORTATION  2025 RESULTS  Positive net income in...",GlobeNewswire,https://www.globenewswire.com/news-release/2026/03/18/3258457/0/en/Touax-Results-2025.html,EURUSD=X,euro dollar exchange rate,"Touax: Results 2025. PRESS RELEASE        Paris, 18 March 2026 – 5:45pm  YOUR OPERATIONAL LEASING SOLUTION FOR SUSTAINABLE TRANSPORTATION  2025 RESULTS  Positive net income in..."
2026-03-19 06:00:55,Europe's central banks are no longer in a 'good place' as Iran war upends forecasts,"The war in Iran has upset the economic equilibrium Europe threatening energy supplies, growth and the outlook for consumer prices, upsetting economic forecasts.",CNBC,https://www.cnbc.com/2026/03/19/ecb-boe-swiss-national-bank-riksbank-interest-rate-decisions.html,EURUSD=X,ECB monetary policy,"Europe's central banks are no longer in a 'good place' as Iran war upends forecasts. The war in Iran has upset the economic equilibrium Europe threatening energy supplies, growth and the outlook for consumer prices, upsetting economic forecasts."
2026-03-19 07:54:26,ECB to talk tough as Iran war raises inflation fears,The European Central Bank is all but certain to keep its key interest rate on hold at 2% today but will make clear it stands ready to raise it if the Iran war fuels a lasting surge in euro zone inflation.,RTE,https://www.rte.ie/news/business/2026/0319/1564100-ecb-to-talk-tough-as-iran-war-raises-inflation-fears/,EURUSD=X,ECB monetary policy,ECB to talk tough as Iran war raises inflation fears. The European Central Bank is all but certain to keep its key interest rate on hold at 2% today but will make clear it stands ready to raise it if the Iran war fuels a lasting surge in euro zone inflation.
2026-03-19 08:46:32,Oil And Natural Gas Prices Soar As Iran Attacks Gulf Energy Facilities,"Brent crude, the international benchmark, rose to near $114 per barrel, up from under $73 per barrel on the eve of the war.",HuffPost,https://www.huffpost.com/entry/financial-markets-iran-war_n_69bbb6d3e4b05b29d3cab5a8,EURUSD=X,euro dollar exchange rate,"Oil And Natural Gas Prices Soar As Iran Attacks Gulf Energy Facilities. Brent crude, the international benchmark, rose to near $114 per barrel, up from under $73 per barrel on the eve of the war."
2026-03-19 08:55:04,"Swiss National Bank keeps rates at zero, eyes Iran war","The Swiss National Bank kept its policy rate ⁠on hold today in the face of a surge in the value of the Swiss franc driven by the Iran war, which also led to a spike in global oil prices, blurring the inflation outlook.",RTE,https://www.rte.ie/news/business/2026/0319/1564118-swiss-national-bank-keeps-rates-at-zero/,EURUSD=X,euro dollar exchange rate,"Swiss National Bank keeps rates at zero, eyes Iran war. The Swiss National Bank kept its policy rate ⁠on hold today in the face of a surge in the value of the Swiss franc driven by the Iran war, which also led to a spike in global oil prices, blurring the inflation outlook."
2026-03-19 09:01:59,"Global Markets | European shares decline as Mideast war worsens, focus shifts to ECB decision",European shares slipped on Thursday as an intensifying conflict in the Middle East ‌sapped ⁠risk appetite while ⁠markets awaited the European Central Bank's monetary policy ​verdict.,The Times of India,https://economictimes.indiatimes.com/markets/us-stocks/news/global-markets-european-shares-decline-as-mideast-war-worsens-focus-shifts-to-ecb-decision/articleshow/129675248.cms,EURUSD=X,ECB monetary policy,"Global Markets | European shares decline as Mideast war worsens, focus shifts to ECB decision. European shares slipped on Thursday as an intensifying conflict in the Middle East ‌sapped ⁠risk appetite while ⁠markets awaited the European Central Bank's monetary policy ​verdict."
2026-03-19 09:56:54,ECB opens digital euro work on ATMs and payment terminals,"The workstreams will explore how a digital euro would operate in real-world settings, including offline use and compatibility with payment devices.",Cointelegraph,https://cointelegraph.com/news/ecb-digital-euro-atm-payments-workstreams,EURUSD=X,ECB monetary policy,"ECB opens digital euro work on ATMs and payment terminals. The workstreams will explore how a digital euro would operate in real-world settings, including offline use and compatibility with payment devices."
2026-03-19 10:03:31,"Traders Boost Bets on BOE, ECB Hikes Just Hours Before Decisions",The threat of an energy crisis drove traders to bet on more interest-rate hikes from the Bank of England and European Central Bank just hours before policymakers are due to announce their latest decisions.,Financial Post,https://financialpost.com/pmn/business-pmn/traders-boost-bets-on-boe-ecb-hikes-just-hours-before-decisions,EURUSD=X,ECB monetary policy,"Traders Boost Bets on BOE, ECB Hikes Just Hours Before Decisions. The threat of an energy crisis drove traders to bet on more interest-rate hikes from the Bank of England and European Central Bank just hours before policymakers are due to announce their latest decisions."
2026-03-19 10:34:22,"Stock Market Highlights: Sensex plunges 2,496.89 points to settle at 74,207.24; Nifty tanks 775.65 points to 23,002.15","Sensex, Nifty Highlights on 19 March 2026: The Nifty 50 fell 3.26% to 23,002.15 points, while the BSE ‌Sensex also lost as much to settle at 74,207.24. The Indian rupee is expected to ‌fall past the 93 to dollar mark when ‌the ⁠local FX market opens after a d…",BusinessLine,https://www.thehindubusinessline.com/markets/stock-market-highlights-march-19-2026/article70757921.ece,EURUSD=X,euro dollar exchange rate,"Stock Market Highlights: Sensex plunges 2,496.89 points to settle at 74,207.24; Nifty tanks 775.65 points to 23,002.15. Sensex, Nifty Highlights on 19 March 2026: The Nifty 50 fell 3.26% to 23,002.15 points, while the BSE ‌Sensex also lost as much to settle at 74,207.24. The Indian rupee is expected to ‌fall past the 93 to dollar mark when ‌the ⁠local FX market opens after a d…"
