published_at,title,description,source,url,symbol,query,text
2026-03-26 15:07:52,Bitcoin discount ending soon? Key levels revealed as analyst says Buy window is closing fast,"Bitcoin buy window 2026 explained: Bitcoin might be entering its 'final discount' phase, with a key buying window potentially opening between October 6-16, according to analyst Ali Martinez. He suggests a price range of $41,500-$45,000 could precede a signifi…",The Times of India,https://economictimes.indiatimes.com/news/international/us/bitcoin-discount-ending-soon-key-levels-revealed-as-analyst-says-buy-window-is-closing-fast/articleshow/129827171.cms,BTC-USD,crypto market rally,"Bitcoin discount ending soon? Key levels revealed as analyst says Buy window is closing fast. Bitcoin buy window 2026 explained: Bitcoin might be entering its 'final discount' phase, with a key buying window potentially opening between October 6-16, according to analyst Ali Martinez. He suggests a price range of $41,500-$45,000 could precede a signifi…"
2026-03-26 15:18:38,Market Analysts Say Cardano Likely to Soar 200% if this ADA Accumulation Zone Holds,"Cardano (ADA) traded in a tight range on Thursday, showing limited price movement despite a noticeable increase in market liquidity.

Originally published on ZyCrypto - blockchain news, expert analysis, and Web3 coverage.
Full article at ZyCrypto.com",ZyCrypto,https://zycrypto.com/market-analysts-say-cardano-likely-to-soar-200-if-this-ada-accumulation-zone-holds/,BTC-USD,crypto market rally,"Market Analysts Say Cardano Likely to Soar 200% if this ADA Accumulation Zone Holds. Cardano (ADA) traded in a tight range on Thursday, showing limited price movement despite a noticeable increase in market liquidity.

Originally published on ZyCrypto - blockchain news, expert analysis, and Web3 coverage.
Full article at ZyCrypto.com"
2026-03-26 15:30:26,"BTC Whales Build Massive Sell Walls At $72,000 As Bitcoin Rally Stalls","Bitcoin (BTC) traded sideways on Thursday, stalling after a volatile week as attempts to push higher ran into heavy resistance.

Originally published on ZyCrypto - blockchain news, expert analysis, and Web3 coverage.
Full article at ZyCrypto.com",ZyCrypto,https://zycrypto.com/btc-whales-build-massive-sell-walls-at-72000-as-bitcoin-rally-stalls/,BTC-USD,crypto market rally,"BTC Whales Build Massive Sell Walls At $72,000 As Bitcoin Rally Stalls. Bitcoin (BTC) traded sideways on Thursday, stalling after a volatile week as attempts to push higher ran into heavy resistance.

Originally published on ZyCrypto - blockchain news, expert analysis, and Web3 coverage.
Full article at ZyCrypto.com"
2026-03-26 15:54:26,"Why is US stock market crashing today? Dow, Nasdaq, S&P 500 down as oil prices surge - here's why tech stocks falling faster than the broader market","US stock market crash today deepened as the Dow Jones Industrial Average fell 222 points, while the Nasdaq Composite dropped 1.11% and the S&P 500 lost 0.83%. Stocks are down sharply. Oil prices are rising fast. Brent crossed $100. This is driving fear. Inves…",The Times of India,https://economictimes.indiatimes.com/news/international/us/why-is-us-stock-market-crashing-today-dow-nasdaq-sp-500-down-as-oil-prices-surge-heres-why-tech-stocks-falling-faster-than-the-broader-market/articleshow/129829167.cms,BTC-USD,crypto market rally,"Why is US stock market crashing today? Dow, Nasdaq, S&P 500 down as oil prices surge - here's why tech stocks falling faster than the broader market. US stock market crash today deepened as the Dow Jones Industrial Average fell 222 points, while the Nasdaq Composite dropped 1.11% and the S&P 500 lost 0.83%. Stocks are down sharply. Oil prices are rising fast. Brent crossed $100. This is driving fear. Inves…"
2026-03-26 16:06:05,Tether launches XAUt on BNB Chain as gold trading moves deeper into crypto,"Tether launches XAUt on BNB Chain as gold cools from January highs, expanding tokenized bullion access amid rising crypto market demand.
The post Tether launches XAUt on BNB Chain as gold trading moves deeper into crypto appeared first on Crypto Briefing.",Crypto Briefing,https://cryptobriefing.com/tether-gold-launch-on-bnb-chain/,BTC-USD,crypto market rally,"Tether launches XAUt on BNB Chain as gold trading moves deeper into crypto. Tether launches XAUt on BNB Chain as gold cools from January highs, expanding tokenized bullion access amid rising crypto market demand.
The post Tether launches XAUt on BNB Chain as gold trading moves deeper into crypto appeared first on Crypto Briefing."
2026-03-26 16:08:42,"Bitcoin holds ground as gold, silver slide on ETF outflows and liquidity strains: JPMorgan","The bank said institutional unwinding and weakening liquidity have hit precious metals, while bitcoin shows steadier flows and improving momentum amid geopolitical stress.",CoinDesk,https://www.coindesk.com/markets/2026/03/26/bitcoin-holds-ground-as-gold-silver-slide-on-etf-outflows-and-liquidity-strains-jpmorgan,GC=F,gold futures rally,"Bitcoin holds ground as gold, silver slide on ETF outflows and liquidity strains: JPMorgan. The bank said institutional unwinding and weakening liquidity have hit precious metals, while bitcoin shows steadier flows and improving momentum amid geopolitical stress."
2026-03-26 16:30:29,Over $6B: XAUT Futures Volume Rewrites Records On Binance,"A gold-backed crypto token jumped from 453rd place to fifth among the most actively traded perpetual pairs on Binance — all within a matter of weeks. Related Reading: Iran Rejects Peace Talk Claims, Leaving Bitcoin Stuck At $70K XAUT: From Obscurity To The To…",newsBTC,http://www.newsbtc.com/altcoin/over-6b-xaut-futures-volume-rewrites-records-on-binance/,BTC-USD,crypto market rally,"Over $6B: XAUT Futures Volume Rewrites Records On Binance. A gold-backed crypto token jumped from 453rd place to fifth among the most actively traded perpetual pairs on Binance — all within a matter of weeks. Related Reading: Iran Rejects Peace Talk Claims, Leaving Bitcoin Stuck At $70K XAUT: From Obscurity To The To…"
2026-03-26 16:45:18,Hackers sneak crypto wallet-stealing code into a popular AI tool that runs every time,"A poisoned release of LiteLLM turned a routine Python install into a crypto-aware secret stealer that searched for wallets, Solana validator material, and cloud credentials every time Python started. On Mar. 24, between 10:39 UTC and 16:00 UTC, an attacker wh…",CryptoSlate,https://cryptoslate.com/hackers-sneak-crypto-wallet-stealing-code-into-a-popular-ai-tool-that-runs-every-time/,ETH-USD,DeFi market,"Hackers sneak crypto wallet-stealing code into a popular AI tool that runs every time. A poisoned release of LiteLLM turned a routine Python install into a crypto-aware secret stealer that searched for wallets, Solana validator material, and cloud credentials every time Python started. On Mar. 24, between 10:39 UTC and 16:00 UTC, an attacker wh…"
2026-03-26 16:45:59,"MARA Holdings’ Bitcoin Sell-Off: 15,000 BTC Liquidated As Prices Crash Below $69,000","Bitcoin (BTC) slipped below $69,000 on Thursday, erasing gains seen earlier in the week as MARA Holdings (MARA), the largest crypto mining company in the United States, disclosed a substantial liquidation of its BTC holdings to fund an expansion into artifici…",newsBTC,http://www.newsbtc.com/bitcoin-news/mara-bitcoin-sell-off-15000-btc-liquidated-as-prices-crash-below-69000/,BTC-USD,crypto market rally,"MARA Holdings’ Bitcoin Sell-Off: 15,000 BTC Liquidated As Prices Crash Below $69,000. Bitcoin (BTC) slipped below $69,000 on Thursday, erasing gains seen earlier in the week as MARA Holdings (MARA), the largest crypto mining company in the United States, disclosed a substantial liquidation of its BTC holdings to fund an expansion into artifici…"
2026-03-26 16:51:04,Why big banks are snubbing open ledgers to build their own private blockchains,"DRW founder Don Wilson says public blockchains conflict with how institutions trade and manage risk, limiting adoption.",CoinDesk,https://www.coindesk.com/business/2026/03/26/why-big-banks-are-snubbing-open-ledgers-to-build-their-own-private-blockchains,ETH-USD,DeFi market,"Why big banks are snubbing open ledgers to build their own private blockchains. DRW founder Don Wilson says public blockchains conflict with how institutions trade and manage risk, limiting adoption."
2026-03-26 17:08:03,Stagflation is back,"For companies and governments across the world, the damage from the Iran conflict is mounting, and with it the risk of stagflation. Read now",Financial Post,https://financialpost.com/financial-times/stagflation-is-back,EURUSD=X,ECB monetary policy,"Stagflation is back. For companies and governments across the world, the damage from the Iran conflict is mounting, and with it the risk of stagflation. Read now"
2026-03-26 18:00:31,"Expert Analyst Says Bitcoin Expansion Is Over, It Won’t Rally Until This Is Over","Bitcoin’s next move is one of the most debated questions in the market right now. One side sees the current price structure as a base for a push to new all-time highs, pointing to strength around $70,000 and repeated rebounds above this price level. Another c…",newsBTC,http://www.newsbtc.com/news/bitcoin/bitcoin-expansion-is-over/,BTC-USD,crypto market rally,"Expert Analyst Says Bitcoin Expansion Is Over, It Won’t Rally Until This Is Over. Bitcoin’s next move is one of the most debated questions in the market right now. One side sees the current price structure as a base for a push to new all-time highs, pointing to strength around $70,000 and repeated rebounds above this price level. Another c…"
2026-03-26 18:00:33,XRP Shows Unusual Stability As Volatility Hits 2026 Low – Here’s What This Means,"XRP’s price is bullish once again, holding strong above the $1.40 level following a recovery across the broader cryptocurrency market. This bullish performance of the price is turning up on several key metrics, such as Realized Volatility, which has recently …",Bitcoinist,https://bitcoinist.com/xrp-shows-unusual-stability/,BTC-USD,crypto market rally,"XRP Shows Unusual Stability As Volatility Hits 2026 Low – Here’s What This Means. XRP’s price is bullish once again, holding strong above the $1.40 level following a recovery across the broader cryptocurrency market. This bullish performance of the price is turning up on several key metrics, such as Realized Volatility, which has recently …"
2026-03-26 18:15:00,Bittensor's TAO price may plunge 40% within five weeks: Fractal data,"TAO has surged 160% in just over a month, but the token is now flashing a familiar golden cross that has preceded sharp price corrections in the past.",Cointelegraph,https://cointelegraph.com/markets/bittensor-tao-price-may-punge-40percent-five-weeks,BTC-USD,crypto market rally,"Bittensor's TAO price may plunge 40% within five weeks: Fractal data. TAO has surged 160% in just over a month, but the token is now flashing a familiar golden cross that has preceded sharp price corrections in the past."
2026-03-26 19:26:41,Donald Trump Says High Costs During Iran War Don't 'Matter To Me',"“I thought that the oil prices would go up higher. I thought the stock market would go somewhat lower,” the president said.",HuffPost,https://www.huffpost.com/entry/donald-trump-says-he-thought-iran-war-would-make-prices-go-up-higher-actually_n_69c55dffe4b09f8e00506220,BTC-USD,crypto market rally,"Donald Trump Says High Costs During Iran War Don't 'Matter To Me'. “I thought that the oil prices would go up higher. I thought the stock market would go somewhat lower,” the president said."
2026-03-26 19:30:34,Ethereum Foundation Holds Invite-Only Event For Institutions In New York City – What Is It About?,"The Ethereum Foundation brought together some of the world’s most influential financial players in New York City for an exclusive, invitation-only institutional forum on how traditional finance is engaging with ETH. This gathering signals a growing focus on b…",newsBTC,http://www.newsbtc.com/news/ethereum/ethereum-foundation-event/,ETH-USD,DeFi market,"Ethereum Foundation Holds Invite-Only Event For Institutions In New York City – What Is It About?. The Ethereum Foundation brought together some of the world’s most influential financial players in New York City for an exclusive, invitation-only institutional forum on how traditional finance is engaging with ETH. This gathering signals a growing focus on b…"
2026-03-26 19:45:20,The $100 billion corporate Bitcoin surge is down to one buyer as other companies stop adding,"The corporate Bitcoin treasury boom is losing oxygen: a $100 billion public-company bet has shrunk, buying has collapsed outside Strategy (formerly MicroStrategy), and the financing model that drove the trade is starting to fail. Data from CryptoQuant show th…",CryptoSlate,https://cryptoslate.com/the-100-billion-corporate-bitcoin-surge-is-down-to-one-buyer-as-others-stop-adding/,BTC-USD,crypto market rally,"The $100 billion corporate Bitcoin surge is down to one buyer as other companies stop adding. The corporate Bitcoin treasury boom is losing oxygen: a $100 billion public-company bet has shrunk, buying has collapsed outside Strategy (formerly MicroStrategy), and the financing model that drove the trade is starting to fail. Data from CryptoQuant show th…"
2026-03-26 19:52:24,Japan‘s financial watchdog flags KuCoin for OTC derivatives transactions,The FSA notice against four crypto-related platforms came as the financial watchdog prepares to shift the legal framework under which digital assets are regulated in Japan.,Cointelegraph,https://cointelegraph.com/news/japan-fsa-kucoin-otc-derivatives-transactions,ETH-USD,DeFi market,Japan‘s financial watchdog flags KuCoin for OTC derivatives transactions. The FSA notice against four crypto-related platforms came as the financial watchdog prepares to shift the legal framework under which digital assets are regulated in Japan.
2026-03-26 22:16:00,"Silo Introduces Silo v3, a New Class of Money Markets Designed to Remain Solvent Without Reliance on DEX Liquidity","Silo v3 replaces reliance on DEX liquidity with protocol-level insolvency protection, expanding onchain credit markets beyond highly liquid assets Silo v3 replaces reliance on DEX liquidity with protocol-level insolvency protection, expanding onchain credit m…",GlobeNewswire,https://www.globenewswire.com/news-release/2026/03/26/3263502/0/en/Silo-Introduces-Silo-v3-a-New-Class-of-Money-Markets-Designed-to-Remain-Solvent-Without-Reliance-on-DEX-Liquidity.html,ETH-USD,DeFi market,"Silo Introduces Silo v3, a New Class of Money Markets Designed to Remain Solvent Without Reliance on DEX Liquidity. Silo v3 replaces reliance on DEX liquidity with protocol-level insolvency protection, expanding onchain credit markets beyond highly liquid assets Silo v3 replaces reliance on DEX liquidity with protocol-level insolvency protection, expanding onchain credit m…"
2026-03-26 22:57:54,David Sacks Leaves White House Crypto Role With Key Legislation Still Unresolved,Sacks will continue advising the White House on technology policy as Congress debates market structure legislation that has formed the core of the administration’s crypto agenda.,Decrypt,https://decrypt.co/362531/david-sacks-leaves-white-house-crypto-role-legislation,ETH-USD,DeFi market,David Sacks Leaves White House Crypto Role With Key Legislation Still Unresolved. Sacks will continue advising the White House on technology policy as Congress debates market structure legislation that has formed the core of the administration’s crypto agenda.
2026-03-26 23:28:00,New Crypto: Pepeto Announces $8.4M Raised While Ethereum Price Targets New ATH Despite Crypto crash,"Dubai, UAE, March 26, 2026 (GLOBE NEWSWIRE) -- The Ethereum based new crypto Pepeto announced its latest presale update with total funds reaching $8.4 million and the pace accelerating faster than any meme coin presale this cycle. The community treats this as…",GlobeNewswire,https://www.globenewswire.com/news-release/2026/03/26/3263516/0/en/New-Crypto-Pepeto-Announces-8-4M-Raised-While-Ethereum-Price-Targets-New-ATH-Despite-Crypto-crash.html,ETH-USD,DeFi market,"New Crypto: Pepeto Announces $8.4M Raised While Ethereum Price Targets New ATH Despite Crypto crash. Dubai, UAE, March 26, 2026 (GLOBE NEWSWIRE) -- The Ethereum based new crypto Pepeto announced its latest presale update with total funds reaching $8.4 million and the pace accelerating faster than any meme coin presale this cycle. The community treats this as…"
2026-03-26 23:49:00,Crypto News: Pepeto Exchange Upgrade While XRP Price Might Reach $5 Soon - Here Is What Every Holder Need To Know,"Dubai, UAE, March 26, 2026 (GLOBE NEWSWIRE) -- The Pepeto project just delivered a fresh security upgrade across its exchange while the XRP price prediction improves on real catalysts. In the same context, crypto news reports show that XRP whale wallets are e…",GlobeNewswire,https://www.globenewswire.com/news-release/2026/03/26/3263521/0/en/Crypto-News-Pepeto-Exchange-Upgrade-While-XRP-Price-Might-Reach-5-Soon-Here-Is-What-Every-Holder-Need-To-Know.html,ETH-USD,DeFi market,"Crypto News: Pepeto Exchange Upgrade While XRP Price Might Reach $5 Soon - Here Is What Every Holder Need To Know. Dubai, UAE, March 26, 2026 (GLOBE NEWSWIRE) -- The Pepeto project just delivered a fresh security upgrade across its exchange while the XRP price prediction improves on real catalysts. In the same context, crypto news reports show that XRP whale wallets are e…"
2026-03-27 00:33:00,Ethereum Based Crypto Pepeto Announces DeFi Tools Update While Cardano Price Target Remains Optimistic Despite 71% Crash,"Dubai, UAE, March 26, 2026 (GLOBE NEWSWIRE) -- The Ethereum based crypto Pepeto just announced a major DeFi tools update across its exchange, bridge, and AI security layer, and the presale crossed $8.4 million as rounds close faster every stage.",GlobeNewswire,https://www.globenewswire.com/news-release/2026/03/27/3263528/0/en/Ethereum-Based-Crypto-Pepeto-Announces-DeFi-Tools-Update-While-Cardano-Price-Target-Remains-Optimistic-Despite-71-Crash.html,ETH-USD,DeFi market,"Ethereum Based Crypto Pepeto Announces DeFi Tools Update While Cardano Price Target Remains Optimistic Despite 71% Crash. Dubai, UAE, March 26, 2026 (GLOBE NEWSWIRE) -- The Ethereum based crypto Pepeto just announced a major DeFi tools update across its exchange, bridge, and AI security layer, and the presale crossed $8.4 million as rounds close faster every stage."
2026-03-27 01:00:24,XRP Season About To Start? Historical Oversold Levels Point To Major Rally,"A decade of price data, a modified RSI sitting at 33, and a macro support line that has survived every significant crash since 2014. This is the current state of XRP’s price action, and according to a technical outlook, the cryptocurrency is now moving around…",Bitcoinist,https://bitcoinist.com/xrp-season-about-to-start/,BTC-USD,crypto market rally,"XRP Season About To Start? Historical Oversold Levels Point To Major Rally. A decade of price data, a modified RSI sitting at 33, and a macro support line that has survived every significant crash since 2014. This is the current state of XRP’s price action, and according to a technical outlook, the cryptocurrency is now moving around…"
2026-03-27 01:35:46,Ether needs these 3 indicators to flip to trigger rally above $2.4K,"Spot ETF outlflows, falling DEX volumes and a declining ETH futures premium may be preventing Ether from rallying, but flipping them could catalyze a rally to $2,400.",Cointelegraph,https://cointelegraph.com/markets/ether-needs-these-3-indicators-to-flip-to-trigger-rally-above-2-4k,BTC-USD,crypto market rally,"Ether needs these 3 indicators to flip to trigger rally above $2.4K. Spot ETF outlflows, falling DEX volumes and a declining ETH futures premium may be preventing Ether from rallying, but flipping them could catalyze a rally to $2,400."
2026-03-27 04:59:20,"Gold rises on softer dollar, on track for fourth weekly drop",Gold rises over 1% amid a weaker dollar but faces a fourth weekly decline due to inflation concerns and higher interest rates.,BusinessLine,https://www.thehindubusinessline.com/markets/gold/gold-rises-on-softer-dollar-on-track-for-fourth-weekly-drop/article70791225.ece,GC=F,gold futures rally,"Gold rises on softer dollar, on track for fourth weekly drop. Gold rises over 1% amid a weaker dollar but faces a fourth weekly decline due to inflation concerns and higher interest rates."
2026-03-27 07:01:09,"Ethereum’s Evolution Not Linear, But Rather Fundamental — Market Expert Takes Deep Dive","Surging activity in decentralized finance, non-fungible tokens, and genuine demand for transaction capacity drove hash rates sharply higher.",ZyCrypto,https://zycrypto.com/ethereums-evolution-not-linear-but-rather-fundamental-market-expert-takes-deep-dive/,BTC-USD,crypto market rally,"Ethereum’s Evolution Not Linear, But Rather Fundamental — Market Expert Takes Deep Dive. Surging activity in decentralized finance, non-fungible tokens, and genuine demand for transaction capacity drove hash rates sharply higher."
2026-03-27 07:04:16,Trader Who Nailed October 2025 Bitcoin Top Says There’s No Chance BTC Goes on a Bull Run Soon – Here’s Why,"A crypto strategist known for making timely Bitcoin calls believes a BTC bull rally is still a ways off. The widely followed pseudonymous crypto trader Wick tells his 155,800 followers on X that the S&P 500 (SPX) is printing a bearish pattern against Bitcoin,…",The Daily Hodl,https://dailyhodl.com/2026/03/27/trader-who-nailed-october-2025-bitcoin-top-says-theres-no-chance-btc-goes-on-a-bull-run-soon-heres-why/,BTC-USD,crypto market rally,"Trader Who Nailed October 2025 Bitcoin Top Says There’s No Chance BTC Goes on a Bull Run Soon – Here’s Why. A crypto strategist known for making timely Bitcoin calls believes a BTC bull rally is still a ways off. The widely followed pseudonymous crypto trader Wick tells his 155,800 followers on X that the S&P 500 (SPX) is printing a bearish pattern against Bitcoin,…"
2026-03-27 08:36:39,"Understanding Altcoins: Types, Examples, and How They Work in 2026","First there was Bitcoin. Every digital currency introduced afterward usually fits into a group known as altcoins. Features absent from Bitcoin’s design began showing up...
The post Understanding Altcoins: Types, Examples, and How They Work in 2026 appeared fi…",Bitcoinfoundation.org,https://bitcoinfoundation.org/news/altcoins/understanding-altcoins-types-examples-and-how-they-work-in-2026/,ETH-USD,DeFi market,"Understanding Altcoins: Types, Examples, and How They Work in 2026. First there was Bitcoin. Every digital currency introduced afterward usually fits into a group known as altcoins. Features absent from Bitcoin’s design began showing up...
The post Understanding Altcoins: Types, Examples, and How They Work in 2026 appeared fi…"
2026-03-27 09:00:00,ECB Consumer Expectations Survey results – February 2026,The European Central Bank (ECB) is the central bank of the European Union countries which have adopted the euro. Our main task is to maintain price stability in the euro area and so preserve the purchasing power of the single currency.,Europa.eu,https://www.ecb.europa.eu/press/pr/date/2026/html/ecb.pr260327~d8261341ca.en.html,EURUSD=X,ECB monetary policy,ECB Consumer Expectations Survey results – February 2026. The European Central Bank (ECB) is the central bank of the European Union countries which have adopted the euro. Our main task is to maintain price stability in the euro area and so preserve the purchasing power of the single currency.
2026-03-27 10:31:00,Coinbase standoff over stablecoin reward CLARITY is now holding up rules for the entire US crypto market,"The stablecoin yield fight has once again consumed the CLARITY Act debate on Capitol Hill, and the cost of that consumption is now measurable. The bill stalled in January when Coinbase objected to its terms, a White House meeting in February failed to break t…",CryptoSlate,https://cryptoslate.com/coinbase-standoff-over-stablecoin-reward-clarity-is-now-holding-up-rules-for-the-entire-us-crypto-market/,ETH-USD,DeFi market,"Coinbase standoff over stablecoin reward CLARITY is now holding up rules for the entire US crypto market. The stablecoin yield fight has once again consumed the CLARITY Act debate on Capitol Hill, and the cost of that consumption is now measurable. The bill stalled in January when Coinbase objected to its terms, a White House meeting in February failed to break t…"
2026-03-27 11:04:20,Bitcoin drops to two-week low as $300 million in longs are liquidated,"Bitcoin fell below $67,000 and ether dropped toward $2,000 as equities weakened, oil topped $100 and leveraged longs unwound, signaling fragile sentiment.",CoinDesk,https://www.coindesk.com/markets/2026/03/27/bitcoin-drops-to-two-week-low-as-usd300-million-in-longs-are-liquidated,BTC-USD,crypto market rally,"Bitcoin drops to two-week low as $300 million in longs are liquidated. Bitcoin fell below $67,000 and ether dropped toward $2,000 as equities weakened, oil topped $100 and leveraged longs unwound, signaling fragile sentiment."
2026-03-27 12:00:00,BTCS Reports 305% Year-Over-Year Revenue Growth to Record $16.5 Million for Full Year 2025,BTCS Reports Full Year 2025 Financial Results...,GlobeNewswire,https://www.globenewswire.com/news-release/2026/03/27/3263719/0/en/BTCS-Reports-305-Year-Over-Year-Revenue-Growth-to-Record-16-5-Million-for-Full-Year-2025.html,ETH-USD,DeFi market,BTCS Reports 305% Year-Over-Year Revenue Growth to Record $16.5 Million for Full Year 2025. BTCS Reports Full Year 2025 Financial Results...
